[
	{
		"@id": "urn:ucode:_0000metro1",
		"@type": "odpt:Station",
		"dc:date": "2023-02-01T14:00:00+09:00",
		"geo:lat": 35.67998995203577,
		"geo:long": 139.76761832409147,
		"@context": "http://vocab.odpt.org/context_odpt.jsonld",
		"dc:title": "東京",
		"owl:sameAs": "odpt.Station:TWR.RinkaiMetro.Tokyo",
		"odpt:railway": "odpt.Railway:TWR.RinkaiMetro",
		"odpt:operator": "odpt.Operator:TWR",
		"odpt:stationCode": "RM1",
		"odpt:stationTitle": {
			"en": "Tokyo",
			"ja": "東京",
			"zh-Hans": "東京",
			"zh-Hant": "東京"
		},
		"odpt:stationTimetable": [
			"odpt.StationTimetable:TWR.RinkaiMetro.Tokyo.Inbound.Weekday",
			"odpt.StationTimetable:TWR.RinkaiMetro.Tokyo.Outbound.Weekday"
		],
		"odpt:connectingRailway": []
	},
	{
		"@id": "urn:ucode:_0000metro2",
		"@type": "odpt:Station",
		"dc:date": "2023-02-01T14:00:00+09:00",
		"geo:lat": 35.67498747811995,
		"geo:long": 139.76370087283587,
		"@context": "http://vocab.odpt.org/context_odpt.jsonld",
		"dc:title": "新銀座",
		"owl:sameAs": "odpt.Station:TWR.RinkaiMetro.Shinginza",
		"odpt:railway": "odpt.Railway:TWR.RinkaiMetro",
		"odpt:operator": "odpt.Operator:TWR",
		"odpt:stationCode": "RM2",
		"odpt:stationTitle": {
			"en": "Shinginza",
			"ja": "新銀座"
		},
		"odpt:stationTimetable": [],
		"odpt:connectingRailway": []
	},
	{
		"@id": "urn:ucode:_0000metro3",
		"@type": "odpt:Station",
		"dc:date": "2023-02-01T14:00:00+09:00",
		"geo:lat": 35.665778070081835,
		"geo:long": 139.76947982825013,
		"@context": "http://vocab.odpt.org/context_odpt.jsonld",
		"dc:title": "新築地",
		"owl:sameAs": "odpt.Station:TWR.RinkaiMetro.Shintsukiji",
		"odpt:railway": "odpt.Railway:TWR.RinkaiMetro",
		"odpt:operator": "odpt.Operator:TWR",
		"odpt:stationCode": "RM3",
		"odpt:stationTitle": {
			"en": "Shintsukiji",
			"ja": "新築地"
		},
		"odpt:stationTimetable": [],
		"odpt:connectingRailway": []
	},
	{
		"@id": "urn:ucode:_0000metro4",
		"@type": "odpt:Station",
		"dc:date": "2023-02-01T14:00:00+09:00",
		"geo:lat": 35.65939256639024,
		"geo:long": 139.77759442992416,
		"@context": "http://vocab.odpt.org/context_odpt.jsonld",
		"dc:title": "勝どき",
		"owl:sameAs": "odpt.Station:TWR.RinkaiMetro.Kachidoki",
		"odpt:railway": "odpt.Railway:TWR.RinkaiMetro",
		"odpt:operator": "odpt.Operator:TWR",
		"odpt:stationCode": "RM4",
		"odpt:stationTitle": {
			"en": "Kachidoki",
			"ja": "勝どき"
		},
		"odpt:stationTimetable": [],
		"odpt:connectingRailway": []
	},
	{
		"@id": "urn:ucode:_0000metro5",
		"@type": "odpt:Station",
		"dc:date": "2023-02-01T14:00:00+09:00",
		"geo:lat": 35.65598579905261,
		"geo:long": 139.78107046893876,
		"@context": "http://vocab.odpt.org/context_odpt.jsonld",
		"dc:title": "晴海",
		"owl:sameAs": "odpt.Station:TWR.RinkaiMetro.Harumi",
		"odpt:railway": "odpt.Railway:TWR.RinkaiMetro",
		"odpt:operator": "odpt.Operator:TWR",
		"odpt:stationCode": "RM5",
		"odpt:stationTitle": {
			"en": "Harumi",
			"ja": "晴海"
		},
		"odpt:stationTimetable": [],
		"odpt:connectingRailway": []
	},
	{
		"@id": "urn:ucode:_0000metro6",
		"@type": "odpt:Station",
		"dc:date": "2023-02-01T14:00:00+09:00",
		"geo:lat": 35.6449380691587,
		"geo:long": 139.78478190875546,
		"@context": "http://vocab.odpt.org/context_odpt.jsonld",
		"dc:title": "豊洲市場",
		"owl:sameAs": "odpt.Station:TWR.RinkaiMetro.ToyosuIchiba",
		"odpt:railway": "odpt.Railway:TWR.RinkaiMetro",
		"odpt:operator": "odpt.Operator:TWR",
		"odpt:stationCode": "RM6",
		"odpt:stationTitle": {
			"en": "ToyosuIchiba",
			"ja": "豊洲市場"
		},
		"odpt:stationTimetable": [],
		"odpt:connectingRailway": []
	},
	{
		"@id": "urn:ucode:_0000metro7",
		"@type": "odpt:Station",
		"dc:date": "2023-02-01T14:00:00+09:00",
		"geo:lat": 35.635227934253514,
		"geo:long": 139.79279399832322,
		"@context": "http://vocab.odpt.org/context_odpt.jsonld",
		"dc:title": "東京ビッグサイト",
		"owl:sameAs": "odpt.Station:TWR.RinkaiMetro.TokyoBigSight",
		"odpt:railway": "odpt.Railway:TWR.RinkaiMetro",
		"odpt:operator": "odpt.Operator:TWR",
		"odpt:stationCode": "RM7",
		"odpt:stationTitle": {
			"en": "TokyoBigSight",
			"ja": "東京ビッグサイト"
		},
		"odpt:stationTimetable": [],
		"odpt:connectingRailway": []
	}
]